{
  "$schema": "https://json-schema.org/draft/2020-12/schema",
  "title": "Demo 2 explicit offline configuration",
  "type": "object",
  "required": ["schemaVersion", "purpose", "tenantId", "subscriptionId", "resourceGroup", "nameSuffix", "location", "deniedLocation", "allowedLocations", "policyMode", "allowedConfidentialVmSkus", "vmSize", "imageReference", "network", "hsmName", "hsmRetentionDays", "initialAdminObjectIds", "manualRecoveryObjectId", "sshPublicKey", "sshUser", "sshHost", "sshPort", "sshIdentityFile", "controllerIdentityClientId", "controllerPrincipalId", "liveStorageIdentityPrincipalId", "twinStorageIdentityPrincipalId", "targets", "container", "blob", "watchdogIntervalSeconds", "alertEmail", "budgetAmount", "logRetentionDays", "existingPolicyAssignmentIds", "enableSkr"],
  "additionalProperties": false,
  "properties": {
    "schemaVersion": { "const": 1 },
    "purpose": { "const": "demo2-only" },
    "tenantId": { "$ref": "#/$defs/guid" },
    "subscriptionId": { "$ref": "#/$defs/guid" },
    "manualRecoveryObjectId": { "$ref": "#/$defs/guid" },
    "resourceGroup": { "type": "string", "pattern": "^rg-demo2-[a-z0-9-]{1,60}$" },
    "nameSuffix": { "type": "string", "pattern": "^[a-z0-9]{3,10}$" },
    "location": { "$ref": "#/$defs/location" },
    "deniedLocation": { "$ref": "#/$defs/location" },
    "allowedLocations": { "type": "array", "minItems": 1, "uniqueItems": true, "items": { "$ref": "#/$defs/location" } },
    "policyMode": { "enum": ["sandbox", "existing-slz"] },
    "allowedConfidentialVmSkus": { "type": "array", "minItems": 1, "uniqueItems": true, "items": { "type": "string", "pattern": "^Standard_[A-Za-z0-9_]+$" } },
    "vmSize": { "type": "string", "pattern": "^Standard_[A-Za-z0-9_]+$" },
    "imageReference": {
      "type": "object", "additionalProperties": false, "required": ["publisher", "offer", "sku", "version"],
      "properties": { "publisher": { "$ref": "#/$defs/nonempty" }, "offer": { "$ref": "#/$defs/nonempty" }, "sku": { "$ref": "#/$defs/nonempty" }, "version": { "$ref": "#/$defs/nonempty" } }
    },
    "network": {
      "type": "object", "additionalProperties": false,
      "required": ["vnetCidr", "computeSubnetCidr", "endpointSubnetCidr", "bastionSubnetCidr", "accessMode", "provisionNatGateway"],
      "properties": {
        "vnetCidr": { "$ref": "#/$defs/cidr" },
        "computeSubnetCidr": { "$ref": "#/$defs/cidr" },
        "endpointSubnetCidr": { "$ref": "#/$defs/cidr" },
        "bastionSubnetCidr": { "type": "string" },
        "accessMode": { "enum": ["bastion", "existing-private-connection"] },
        "provisionNatGateway": { "type": "boolean" }
      }
    },
    "hsmName": { "type": "string", "pattern": "^hsm-demo2-[a-z0-9-]{1,14}$" },
    "hsmRetentionDays": { "type": "integer", "minimum": 7, "maximum": 90 },
    "initialAdminObjectIds": { "type": "array", "minItems": 1, "uniqueItems": true, "items": { "$ref": "#/$defs/guid" } },
    "sshPublicKey": { "type": "string", "pattern": "^(ssh-ed25519|ssh-rsa|ecdsa-sha2-nistp256) [A-Za-z0-9+/=]+( .*)?$" },
    "sshUser": { "type": "string", "pattern": "^[a-z_][a-z0-9_-]{0,30}$" },
    "sshHost": { "type": "string", "pattern": "^[a-zA-Z0-9][a-zA-Z0-9.-]{0,252}$" },
    "sshPort": { "type": "integer", "minimum": 1, "maximum": 65535 },
    "sshIdentityFile": { "type": "string" },
    "controllerIdentityClientId": { "$ref": "#/$defs/resolvedGuid" },
    "controllerPrincipalId": { "$ref": "#/$defs/resolvedGuid" },
    "liveStorageIdentityPrincipalId": { "$ref": "#/$defs/resolvedGuid" },
    "twinStorageIdentityPrincipalId": { "$ref": "#/$defs/resolvedGuid" },
    "targets": {
      "type": "object", "additionalProperties": false, "required": ["Live", "Twin"],
      "properties": { "Live": { "$ref": "#/$defs/target" }, "Twin": { "$ref": "#/$defs/target" } }
    },
    "container": { "type": "string", "pattern": "^[a-z0-9][a-z0-9-]{1,61}[a-z0-9]$" },
    "blob": { "type": "string", "pattern": "^[a-zA-Z0-9._-]{1,100}\\.txt$" },
    "watchdogIntervalSeconds": { "type": "integer", "minimum": 1, "maximum": 10 },
    "alertEmail": { "type": "string", "pattern": "^[^@\\s]+@[^@\\s]+\\.[^@\\s]+$" },
    "budgetAmount": { "type": "number", "exclusiveMinimum": 0 },
    "logRetentionDays": { "type": "integer", "minimum": 30, "maximum": 730 },
    "existingPolicyAssignmentIds": { "type": "array", "uniqueItems": true, "items": { "type": "string", "pattern": "^/subscriptions/[^/]+/.*providers/Microsoft.Authorization/policyAssignments/[^/]+$|^/providers/Microsoft.Management/managementGroups/[^/]+/providers/Microsoft.Authorization/policyAssignments/[^/]+$" } },
    "enableSkr": { "const": false }
  },
  "$defs": {
    "nonempty": { "type": "string", "minLength": 1 },
    "guid": { "type": "string", "pattern": "^[a-fA-F0-9]{8}-[a-fA-F0-9]{4}-[a-fA-F0-9]{4}-[a-fA-F0-9]{4}-[a-fA-F0-9]{12}$" },
    "resolvedGuid": { "anyOf": [{ "const": "" }, { "$ref": "#/$defs/guid" }] },
    "location": { "type": "string", "pattern": "^[a-z][a-z0-9]+$" },
    "cidr": { "type": "string", "pattern": "^([0-9]{1,3}\\.){3}[0-9]{1,3}/([0-9]|[12][0-9]|3[0-2])$" },
    "target": {
      "type": "object", "additionalProperties": false, "required": ["accountName", "keyName", "keyVersion", "recoveryTimeoutSeconds"],
      "properties": {
        "accountName": { "type": "string", "pattern": "^demo2[a-z0-9]{1,19}$" },
        "keyName": { "type": "string", "pattern": "^demo2-[a-z0-9-]{1,100}$" },
        "keyVersion": { "type": "string", "pattern": "^$|^[a-fA-F0-9]{32}$" },
        "recoveryTimeoutSeconds": { "type": "integer", "minimum": 30, "maximum": 3600 }
      }
    }
  }
}
