{
  "schemaVersion": 1,
  "purpose": "demo2-only",
  "tenantId": "",
  "subscriptionId": "",
  "resourceGroup": "",
  "nameSuffix": "",
  "location": "",
  "deniedLocation": "",
  "allowedLocations": [],
  "policyMode": "sandbox",
  "allowedConfidentialVmSkus": [],
  "vmSize": "",
  "imageReference": { "publisher": "", "offer": "", "sku": "", "version": "" },
  "network": {
    "vnetCidr": "",
    "computeSubnetCidr": "",
    "endpointSubnetCidr": "",
    "bastionSubnetCidr": "",
    "accessMode": "bastion",
    "provisionNatGateway": true
  },
  "hsmName": "",
  "hsmRetentionDays": 7,
  "initialAdminObjectIds": [],
  "manualRecoveryObjectId": "",
  "sshPublicKey": "",
  "sshUser": "demooperator",
  "sshHost": "127.0.0.1",
  "sshPort": 50022,
  "sshIdentityFile": "",
  "controllerIdentityClientId": "",
  "controllerPrincipalId": "",
  "liveStorageIdentityPrincipalId": "",
  "twinStorageIdentityPrincipalId": "",
  "targets": {
    "Live": { "accountName": "", "keyName": "demo2-live", "keyVersion": "", "recoveryTimeoutSeconds": 180 },
    "Twin": { "accountName": "", "keyName": "demo2-twin", "keyVersion": "", "recoveryTimeoutSeconds": 1800 }
  },
  "container": "demo",
  "blob": "sovereignty-demo.txt",
  "watchdogIntervalSeconds": 10,
  "alertEmail": "",
  "budgetAmount": 0,
  "logRetentionDays": 30,
  "existingPolicyAssignmentIds": [],
  "enableSkr": false
}
